{
  "generated_at": "2026-07-09",
  "source_roadview_image_review_generated_at": "2026-07-09",
  "asset_root": "data/raw/roadview_images",
  "source_dataset": {
    "title": "제주특별자치도_사회적약자 시설 데이터(로드뷰) 구축 이미지",
    "url": "https://www.data.go.kr/data/15110209/fileData.do",
    "provider": "제주특별자치도",
    "application_required": true,
    "expected_full_dataset_image_count": 4748,
    "expected_full_dataset_size_gb": "23~25",
    "note": "공공데이터포털 페이지 기준 전체 이미지는 활용신청 후 전자매체로 별도 제공"
  },
  "summary": {
    "total_places": 17,
    "total_place_images": 1023,
    "expected_review_sample_images": 102,
    "available_review_sample_images": 102,
    "missing_review_sample_images": 0,
    "by_status": {
      "ready_for_visual_review": 17
    },
    "by_review_decision": {
      "ready_for_visual_review": 17
    }
  },
  "items": [
    {
      "card": {
        "id": "jeju_roadview_place_038",
        "name": "국립제주박물관",
        "region": "제주시",
        "category": "indoor",
        "verification_status": "partial"
      },
      "status": "ready_for_visual_review",
      "expected_review_sample_count": 6,
      "available_review_sample_count": 6,
      "missing_review_sample_count": 0,
      "total_place_image_count": 132,
      "review_decision": "ready_for_visual_review",
      "images": [
        {
          "image_file_name": "JEJUNATIONALMU-1-001",
          "captured_at": "2022-08-23 09:35",
          "latitude": 33.512772194444445,
          "longitude": 126.54902219444445,
          "resolution": "6720*3360",
          "expected_relative_paths": [
            "data/raw/roadview_images/JEJUNATIONALMU-1-001.jpg",
            "data/raw/roadview_images/JEJUNATIONALMU-1-001.JPG",
            "data/raw/roadview_images/JEJUNATIONALMU-1-001.jpeg",
            "data/raw/roadview_images/JEJUNATIONALMU-1-001.png"
          ],
          "present_path": "data/raw/roadview_images/JEJUNATIONALMU-1-001.jpg",
          "status": "available"
        },
        {
          "image_file_name": "JEJUNATIONALMU-1-027",
          "captured_at": "2022-08-23 11:38",
          "latitude": 33.51333888888889,
          "longitude": 126.54957222222222,
          "resolution": "6720*3360",
          "expected_relative_paths": [
            "data/raw/roadview_images/JEJUNATIONALMU-1-027.jpg",
            "data/raw/roadview_images/JEJUNATIONALMU-1-027.JPG",
            "data/raw/roadview_images/JEJUNATIONALMU-1-027.jpeg",
            "data/raw/roadview_images/JEJUNATIONALMU-1-027.png"
          ],
          "present_path": "data/raw/roadview_images/JEJUNATIONALMU-1-027.jpg",
          "status": "available"
        },
        {
          "image_file_name": "JEJUNATIONALMU-1-053",
          "captured_at": "2022-08-23 11:26",
          "latitude": 33.51292775,
          "longitude": 126.54867219444444,
          "resolution": "6720*3360",
          "expected_relative_paths": [
            "data/raw/roadview_images/JEJUNATIONALMU-1-053.jpg",
            "data/raw/roadview_images/JEJUNATIONALMU-1-053.JPG",
            "data/raw/roadview_images/JEJUNATIONALMU-1-053.jpeg",
            "data/raw/roadview_images/JEJUNATIONALMU-1-053.png"
          ],
          "present_path": "data/raw/roadview_images/JEJUNATIONALMU-1-053.jpg",
          "status": "available"
        },
        {
          "image_file_name": "JEJUNATIONALMU-2-019",
          "captured_at": "2022-08-23 10:32",
          "latitude": 33.513288861111114,
          "longitude": 126.54857497222223,
          "resolution": "6720*3360",
          "expected_relative_paths": [
            "data/raw/roadview_images/JEJUNATIONALMU-2-019.jpg",
            "data/raw/roadview_images/JEJUNATIONALMU-2-019.JPG",
            "data/raw/roadview_images/JEJUNATIONALMU-2-019.jpeg",
            "data/raw/roadview_images/JEJUNATIONALMU-2-019.png"
          ],
          "present_path": "data/raw/roadview_images/JEJUNATIONALMU-2-019.jpg",
          "status": "available"
        },
        {
          "image_file_name": "JEJUNATIONALMU-2-045",
          "captured_at": "2022-08-23 10:54",
          "latitude": 33.51295277777778,
          "longitude": 126.54939722222223,
          "resolution": "6720*3360",
          "expected_relative_paths": [
            "data/raw/roadview_images/JEJUNATIONALMU-2-045.jpg",
            "data/raw/roadview_images/JEJUNATIONALMU-2-045.JPG",
            "data/raw/roadview_images/JEJUNATIONALMU-2-045.jpeg",
            "data/raw/roadview_images/JEJUNATIONALMU-2-045.png"
          ],
          "present_path": "data/raw/roadview_images/JEJUNATIONALMU-2-045.jpg",
          "status": "available"
        },
        {
          "image_file_name": "JEJUNATIONALMU-2-070",
          "captured_at": "2022-08-23 11:07",
          "latitude": 33.51332222222222,
          "longitude": 126.54959719444444,
          "resolution": "6720*3360",
          "expected_relative_paths": [
            "data/raw/roadview_images/JEJUNATIONALMU-2-070.jpg",
            "data/raw/roadview_images/JEJUNATIONALMU-2-070.JPG",
            "data/raw/roadview_images/JEJUNATIONALMU-2-070.jpeg",
            "data/raw/roadview_images/JEJUNATIONALMU-2-070.png"
          ],
          "present_path": "data/raw/roadview_images/JEJUNATIONALMU-2-070.jpg",
          "status": "available"
        }
      ],
      "recommended_action": "대표 이미지 파일을 열어 출입구·경사·바닥·주차장 연결 동선 시각 검수 진행"
    },
    {
      "card": {
        "id": "jeju_roadview_place_088",
        "name": "김녕미로공원",
        "region": "제주시",
        "category": "rest_area",
        "verification_status": "partial"
      },
      "status": "ready_for_visual_review",
      "expected_review_sample_count": 6,
      "available_review_sample_count": 6,
      "missing_review_sample_count": 0,
      "total_place_image_count": 15,
      "review_decision": "ready_for_visual_review",
      "images": [
        {
          "image_file_name": "GIMNYEONGMAZEPA-1-001",
          "captured_at": "2022-09-26 10:38",
          "latitude": 33.53617222222222,
          "longitude": 126.77208611111111,
          "resolution": "6720*3360",
          "expected_relative_paths": [
            "data/raw/roadview_images/GIMNYEONGMAZEPA-1-001.jpg",
            "data/raw/roadview_images/GIMNYEONGMAZEPA-1-001.JPG",
            "data/raw/roadview_images/GIMNYEONGMAZEPA-1-001.jpeg",
            "data/raw/roadview_images/GIMNYEONGMAZEPA-1-001.png"
          ],
          "present_path": "data/raw/roadview_images/GIMNYEONGMAZEPA-1-001.jpg",
          "status": "available"
        },
        {
          "image_file_name": "GIMNYEONGMAZEPA-1-004",
          "captured_at": "2022-09-26 10:40",
          "latitude": 33.536052749999996,
          "longitude": 126.7720138611111,
          "resolution": "6720*3360",
          "expected_relative_paths": [
            "data/raw/roadview_images/GIMNYEONGMAZEPA-1-004.jpg",
            "data/raw/roadview_images/GIMNYEONGMAZEPA-1-004.JPG",
            "data/raw/roadview_images/GIMNYEONGMAZEPA-1-004.jpeg",
            "data/raw/roadview_images/GIMNYEONGMAZEPA-1-004.png"
          ],
          "present_path": "data/raw/roadview_images/GIMNYEONGMAZEPA-1-004.jpg",
          "status": "available"
        },
        {
          "image_file_name": "GIMNYEONGMAZEPA-1-007",
          "captured_at": "2022-09-26 10:42",
          "latitude": 33.536252749999996,
          "longitude": 126.77208333333333,
          "resolution": "6720*3360",
          "expected_relative_paths": [
            "data/raw/roadview_images/GIMNYEONGMAZEPA-1-007.jpg",
            "data/raw/roadview_images/GIMNYEONGMAZEPA-1-007.JPG",
            "data/raw/roadview_images/GIMNYEONGMAZEPA-1-007.jpeg",
            "data/raw/roadview_images/GIMNYEONGMAZEPA-1-007.png"
          ],
          "present_path": "data/raw/roadview_images/GIMNYEONGMAZEPA-1-007.jpg",
          "status": "available"
        },
        {
          "image_file_name": "GIMNYEONGMAZEPA-1-009",
          "captured_at": "2022-09-26 10:44",
          "latitude": 33.53635275,
          "longitude": 126.77225833333333,
          "resolution": "6720*3360",
          "expected_relative_paths": [
            "data/raw/roadview_images/GIMNYEONGMAZEPA-1-009.jpg",
            "data/raw/roadview_images/GIMNYEONGMAZEPA-1-009.JPG",
            "data/raw/roadview_images/GIMNYEONGMAZEPA-1-009.jpeg",
            "data/raw/roadview_images/GIMNYEONGMAZEPA-1-009.png"
          ],
          "present_path": "data/raw/roadview_images/GIMNYEONGMAZEPA-1-009.jpg",
          "status": "available"
        },
        {
          "image_file_name": "GIMNYEONGMAZEPA-1-012",
          "captured_at": "2022-09-26 10:45",
          "latitude": 33.53641111111111,
          "longitude": 126.77243052777777,
          "resolution": "6720*3360",
          "expected_relative_paths": [
            "data/raw/roadview_images/GIMNYEONGMAZEPA-1-012.jpg",
            "data/raw/roadview_images/GIMNYEONGMAZEPA-1-012.JPG",
            "data/raw/roadview_images/GIMNYEONGMAZEPA-1-012.jpeg",
            "data/raw/roadview_images/GIMNYEONGMAZEPA-1-012.png"
          ],
          "present_path": "data/raw/roadview_images/GIMNYEONGMAZEPA-1-012.jpg",
          "status": "available"
        },
        {
          "image_file_name": "GIMNYEONGMAZEPA-1-015",
          "captured_at": "2022-09-26 10:48",
          "latitude": 33.53678330555555,
          "longitude": 126.77269444444444,
          "resolution": "6720*3360",
          "expected_relative_paths": [
            "data/raw/roadview_images/GIMNYEONGMAZEPA-1-015.jpg",
            "data/raw/roadview_images/GIMNYEONGMAZEPA-1-015.JPG",
            "data/raw/roadview_images/GIMNYEONGMAZEPA-1-015.jpeg",
            "data/raw/roadview_images/GIMNYEONGMAZEPA-1-015.png"
          ],
          "present_path": "data/raw/roadview_images/GIMNYEONGMAZEPA-1-015.jpg",
          "status": "available"
        }
      ],
      "recommended_action": "대표 이미지 파일을 열어 출입구·경사·바닥·주차장 연결 동선 시각 검수 진행"
    },
    {
      "card": {
        "id": "jeju_roadview_place_100",